{
  "$schema": "../../../../schemas/charades.pack.schema.json",
  "id": "back-to-school",
  "name": "Back to School",
  "description": "Nigerian school days from the 1990s to the 2010s: subjects, rituals, snacks, playground games and the things teachers always said.",
  "language": "en-NG",
  "maturity": "everyone",
  "contributors": ["AdeizaSama"],
  "items": [
    { "text": "Agricultural Science", "tags": ["subject"] },
    { "text": "Further Mathematics", "tags": ["subject"] },
    { "text": "Morning assembly", "tags": ["ritual"], "modes": ["describe", "act"] },
    { "text": "National Anthem", "tags": ["ritual"], "modes": ["describe", "act", "sing"] },
    { "text": "Inter-house sports", "tags": ["ritual"], "modes": ["describe", "act"] },
    { "text": "Visiting day", "tags": ["ritual"], "modes": ["describe", "act"] },
    { "text": "Report card", "tags": ["ritual"], "modes": ["describe", "act"] },
    { "text": "Ghana-must-go", "tags": ["item"], "modes": ["describe", "act"] },
    { "text": "Mathematical set", "tags": ["item"], "modes": ["describe", "act"] },
    { "text": "Nokia 3310", "tags": ["item"], "modes": ["describe", "act"] },
    { "text": "Rewinding cassette with biro", "tags": ["item"], "modes": ["describe", "act"] },
    { "text": "Ten-ten", "tags": ["game"], "modes": ["describe", "act"] },
    { "text": "Suwe", "tags": ["game"], "modes": ["describe", "act"] },
    { "text": "Boju boju", "tags": ["game"], "modes": ["describe", "act"] },
    { "text": "Whot", "tags": ["game"], "modes": ["describe", "act"] },
    { "text": "Ayo", "tags": ["game"], "modes": ["describe", "act"] },
    { "text": "Snake Xenzia", "tags": ["game"], "modes": ["describe", "act"] },
    { "text": "Gala", "tags": ["snack"], "modes": ["describe", "act"] },
    { "text": "Pure water", "tags": ["snack"], "modes": ["describe", "act"] },
    { "text": "Soaking garri", "tags": ["snack"], "modes": ["describe", "act"] },
    { "text": "Puff puff", "tags": ["snack"], "modes": ["describe", "act"] },
    { "text": "Fan Ice", "tags": ["snack"], "modes": ["describe", "act"] },
    { "text": "Pounding yam", "tags": ["chore"], "modes": ["describe", "act"] },
    { "text": "Polishing shoes", "tags": ["chore"], "modes": ["describe", "act"] },
    { "text": "Face your front", "tags": ["phrase"], "modes": ["describe", "act"] },
    { "text": "See me after class", "tags": ["phrase"], "modes": ["describe", "act"] },
    { "text": "Wait till your father comes", "tags": ["phrase"], "modes": ["describe", "act"] },
    { "text": "Head Shoulders Knees and Toes", "tags": ["song"], "modes": ["describe", "act", "sing"] },
    { "text": "Arise O Compatriots", "tags": ["song"], "modes": ["describe", "sing"] },
    { "text": "Egg and spoon race", "tags": ["sport"], "modes": ["describe", "act"] },
    { "text": "Tug of war", "tags": ["sport"], "modes": ["describe", "act"] },
    { "text": "Tuck shop", "tags": ["place"], "modes": ["describe", "act"] },
    { "text": "Ajebutter", "tags": ["slang"], "modes": ["describe", "act"] },
    { "text": "Olodo", "tags": ["slang"], "modes": ["describe", "act"] }
  ]
}
